Title,URL
Predictions of the SARS-CoV-2 Omicron Variant (B.1.1.529) Spike Protein Receptor-Binding Domain Structure and Neutralizing Antibody Interactions,https://www.frontiersin.org/articles/10.3389/fviro.2022.830202
An infectious SARS-CoV-2 B.1.1.529 Omicron virus escapes neutralization by therapeutic monoclonal antibodies,https://www.nature.com/articles/s41591-021-01678-y
Imprinted SARS-CoV-2 humoral immunity induces convergent Omicron RBD evolution,https://www.nature.com/articles/s41586-022-05644-7
Substantial Neutralization Escape by SARS-CoV-2 Omicron Variants BQ.1.1 and XBB.1,https://www.nejm.org/doi/10.1056/NEJMc2214314
ACE2 binding and antibody evasion in enhanced transmissibility of XBB.1.5,https://www.thelancet.com/journals/laninf/article/PIIS1473-3099(23)00010-5/fulltext
